"The modern IT society is based on Internet access, and many corporations, organizations and persons take advantage of the increased accessibility and flexibility that the Internet provides for products, services and information. This can also cause problems for the visually impaired since they cannot always access and use all websites, because of that their aiding devices cannot always interpret all the contents of the website, or that they freeze or sometimes even crash.The purpose of this thesis is therefore to find out how websites should be designed so that they function as well as possible with the aiding devices of the visually impaired, as well as how to make websites as accessible as possible for the visually impaired.By comparing the result of a case study with existing theory, it was concluded that the existing standards and guidelines should be followed to make websites as accessible and user friendly as possible for the visually impaired. One of the many important things regarding accessibility for the visually impaired is the importance of providing ALT texts to images and links, to allow the aiding devices to interpret these. Because it is very common to forget to provide ALT texts on websites today.It is also important to follow the accessibility standards and guidelines that are available for both Flash animations and PDF documents. Modern aiding devices can interpret Flash animations if they follow these standards and guidelines, but most of the aiding devices can still not interpret Flash at all. The aiding devices can also interpret PDF documents if these are made correctly, which, sadly, the often are not.To find a solution for all these problems, and many more, the authors have concluded a number of good advice and requirements based on the experience of visually impaired persons, as well as giving some advice on how to increase accessibility in websites.",Software Design
"Nowadays, Intelligent Tutoring Systems (ITSs) are so regarded in order to improve education quality via new technologies in this area. One of the problems is that the language of ITSs is different from the learner’s. It forces the learners to learn the system language. This paper tries to remove this necessity by using an Automatic Translator Component in system structure like Google Translate API.This system carry out a pre-test and post-test by using Expert System and Jackson Model before and after of training a concept. It constantly updates learner model to save all changes in learning process. So this paper offers an E-Learning system which is web-based, intelligent, adaptive, multilingual and remotely accessible where tutors and learners can have non-identical language. It is also applicable Every Time and Every Where (ETEW). Furthermore, it trains the concepts in the best method with any language and low cost.",Software Design
"Online Course Registration System project is developed in .Net, providing easier registration to courses online saving time. It is developed with ASP.Net. MySQL is used as database.Some of the source code files are:categorysearch.aspx",Software Design
"In Web Based Claims Processing System (WCPS), the employee can fill the claim form online and submit it so that the form is sent to CPD through Internet. At CPD, the form needs to be checked automatically by a program which will compute the amount that needs to be reimbursed to the employee for the treatment undertaken.Technology: ASP.Net 2.0, C#, Java Script, SQL ServerDownload Project Source CodeDownload Installation Guide",Software Design
"Web applications initially became popular much thanks to low deployment costs and programming simplicity. However, as business requirements grow more complex, limitations in the web programming model might become evident.With the advent of techniques such as AJAX, the bar has been raised for what users have come to expect from web applications.However, although web application development often starts off simple, limitations in the web programming model might start to show when the business requirements become more complex. To successfully implement large-scale web application, software developers need to have knowledge of a big set of complementary technologies.This study describes the implementation of a prototype of a central hotel property management system using web technologies. These technologies are then compared to an alternative set of technologies, which are used for implementing a second prototype; a stand-alone desktop client distributed using Java Web Start.The study highlights some of the current problems with the web programming model and shows how the user experience can be improved by instead using desktop technologies.",Software Design
"The main objective of Matrimonial Web Application is to provide Grooms and Brides with excellent matchmaking experience by exploring the opportunities and resources to meet true potential partner. Keeping our objective in mind, we have created a world renowned online matchmaking services that will touch the souls of millions of people all over the globe.The purposes of the Matrimonial Web Application are:Matrimonial Web Application will allow a new user to register and after successfully registration user can get email confirmation, after completing registration users profile will be visible to other users.Download Matrimonial Web Application Project>> List of Projects in other languages like JAVA, ASP.Net, C#.Net, VB.Net, J2EE, J2ME, PHP, SQL etc.",Software Design
"Our web-based interactive game-playing-oriented college selection system acts as an smart advisor/mentor and helps students, parents, and teachers use an effective graphical user interface to efficiently search college information and to make good decisions at each stage of students’ academic development. It is an expert agent with hierarchical fuzzy knowledge base using fuzzy logic.Users are expected to be able to use this agent as a trusted, involved and smart counselor, who remembers their profile and their past history and advises them through their high school years. It gives them increasingly better and specific nuggets of advice as they make progress through their schools, and guides them toward a selected set of colleges to apply that optimizes their potential.At the heart of this system is an assessment tree, which uses bottom-up fuzzy calculations to generate possibility of admission in various sets of colleges. The primary output is a short list of colleges to apply containing five kinds of colleges (highly-selective down to non-selective) with possibilities of acceptance in each college according to fuzzy rules provided.It is also a smart tool to play self-guided  “what if” games to explore what specific action one should be taking to have maximum impact on the selection of colleges one can get in and on his/her chances of admission. It employs a natural interactive interview process for a user (i.e., a user can play a game with the agent to gradually find out rational solutions), and produces advisories at different stages.",Software Design
"A management platform is an integral part of any modern computer network. Its role in any kind of network (research or commercial) is undeniable. By using the management solution, the operators of the network monitor, troubleshoot and manage the network from a centralized location.In a research network such as the Mid Sweden University (MIUN) IPTV test bed, it also plays a very important role. Researchers can setup different configurations for the underlying network according to their research goals.MIUN IPTV test bed is expanding in the sense that it is covering a greater geographical area and more researchers are using the network in order to carry out their experiments. In this project, an attempt will be made to develop a management platform for the IPTV network.This platform will manage the whole network and will give the researchers opportunity to setup trail field by configuring the network devices according to their experiments.",Software Design
"Testing is one of the critical processes in software development life cycle. It plays key role in the success of software product by improving its quality. Web-based applications are emerging and evolving rapidly; their importance and complexity is also increasing.Heterogeneous and diverse nature of distributed components, applications; along with their multi-platform support and cooperativeness make these applications more complex and swiftly increasing in their size. Quality assurance of these applications is becoming more crucial and important; testing is one of the key processes to achieve and ensure the quality of these software or Web-based products.There are many testing challenges involved in Web-based applications. But most importantly interoperability and integration are the most critical testing challenges associated with Web-based applications. There are number of challenging factors involved in both integration and interoperability testing efforts. These integration and interoperability factors have almost 70 percent to 80 percent impact on overall quality of Web-based applications.In software industry different kind of testing approaches are used by practitioners to solve the issues associated with integration and interoperability, which are due to ever increasing complexities of Web-based applications.It is fact that both integration and interoperability are inter-related and it is very helpful to cover all the possible issues of interoperability testing that will reduce the integration testing effort. It will be more beneficial if a dedicated testing team is placed to perform the both integration and interoperability testing.",Software Design
"The research field Knowledge Management (KM) is about improving methods to structure and filter information. A concept browser makes it possible to navigate through complex information structures. Conzilla is such a concept browser. It is designed to present knowledge, to set concepts into relations to each other, and to make browsing through the resulting context-maps possible. Conzilla allows information and content being tied to concepts and concept-relations.The collaboration facilities in Conzilla are limited. Basic elements such as a lookup mechanism and lifecycle information for information structures are missing. Before knowledge can be contributed, it is necessary to make sure that dependencies are fulfilled and the history of an edited object is obtained. This thesis is about providing these missing parts.To be able to load a container, the information about the location of a component has to be held by a central registry. To resolve eventually existing dependencies, it is also necessary to register the components and its references. This project provides a design which eliminates the existing restrictions. The aim is to allow real collaboration through a remote services infrastructure, realized with Collaborilla. The theoretical background is discussed as well as a practical solution, including a prototype of a remote collaboration service.",Software Design
"Medical Diagnostic system for heart diseases is an expert system built using java and Knowledgewright by Amzi Inc. It helps to detect whether a person is suffering from a heart disease. The conclusion is calculated after the user answers to some questions.The program then searches through the knowledge base and as per the rules and facts, it comes up with a conclusion. It all contains some relevant information on the three heart disease that it focuses on. It uses a Heuristic search and follows the forward chaining principle. Please read the “read me” file in the archive before running the application.Download Online Medical Diagnostic System in JAVA>> List of Pharmacy Management System Projects in C#.Net, PHP, VB.Net, JAVA, VB>> List of Hospital Management System Projects in JAVA, ASP.Net, PHP, VB, C, C++, VB.NetMedical Related Projects >>Hospital Related Projects >>",Software Design
"Today, testing applications for Internet (web sites and other applications) is being verified using proprietary test solutions. An application is developed and another application is developed to test the first one. Test Competence Centre at Ericsson AB has expertise on testing telecom applications using TTCN-2 and TTCN-3 notations. These notations have lot of potential and are being used for testing in various areas.So far, not much work has been done on using TTCN notations for testing Internet application. This project was a step through which the capabilities/possibilities of the TTCN notation (in Web testing) could be determined.This project presents investigation results of the 3 different test technologies/tools (TTCN-2, TTCN-3 and a proprietary free software, PureTest) to see which one is the best for testing Internet Applications and what are the drawbacks/benefits each technology has. The background topics included are brief introduction of software testing and web testing, short introduction of TTCN language and its version 2 and 3, description of the tool set representing the chosen technologies, conceptual view of how the tools work, a short description of HTTP protocol and description of HTTP adapter (Test Port).Several benefits and drawbacks were found from all the three technologies but it can be said that at the moment proprietary test solutions (PureTest in this case) is still the best tool to test Internet Application. It scores over other the two technologies (TTCN-2 and TTCN-3) due to reason like flexibility, cost effectiveness, user friendliness, small lead times for competence development etc.TTCN-3 is more of a programming language and is certainly more flexible when compared to TTCN-2. TTCN-3 is still evolving and it can be said that it holds promise. Some of the features are missing which are vital for testing Internet Applications but are better than TTCN-2.",Software Design
"This paper has been made with the health care center Aroma in Vetlanda. The work was to deliver a complete web portal with an integrated booking system.The objectives were to provide a complete informative website for Aromas users with the option to make an appointment for a vaccination or health certificate, order prescriptions and get update information directly published by Aromas staff. And to give the staff of Aroma a graphical Web interface to manage the content and the booking system.The report goes through the basic language used and why. Further it takes up it how works and how the final product looks and behaves.",Software Design
"This feature is made available to public for interaction with police indirectly. This system registers the complaints from people through online and is helpful to the police department in identifying criminals. In this system any person can register their complaint online. The aim of this project is to develop an E-cops reporting and management system which is easily accessible to the public, police department and the administrative department.Generally many crimes seen by the public will not reach to the police due to many reasons like fear, lack of time, ignorance. Due to this reason many cases are not even reported to the police station. Though some cases are registered they are not investigated properly due to lack of evidences and cooperation of the public. This project helps the public to report about the crimes to the police without any fear in correct time.This is also helpful for higher authorities of police to have an overview about the progress of the investigation.This feature is made available to public for interaction with police indirectly. This system registers the complaints from people through online and is helpful to the police department in identifying criminals.In this system any person can register their complaint online.The aim of this project is to develop an E-cops reporting and management system which is easily accessible to the public, police department and the administrative department.",Software Design
"As the core of a previous project, a Web-based tool, called LDBN(Learn DataBase Normalization), was developed. The purpose of this tool is to provide an interactive learning environment for the normalization of relational database schemata whose constraints are defined by functional dependencies (FDs).As a part of this project, some crucial extensions to LDBN, based upon these observations, are developed. The most significant extension is a tool for the visualization of FDs, based upon templates found in popular textbooks. Often, such visual representations are much easier for humans to grasp than purely text-based representations. However, this extension does not compromise the existing capabilities of LDBN. In addition, we present some other shortcomings of the previous version of LDBN and our approach to deal with those, in particular issues surrounding user privileges.",Software Design
"A coherent software environment simplifies maintenance – and using the same terminology facilitates communication and learning within the IT department.Having a mixed and complex software environment could put strain on the IT department. Applications and databases needs to be somehow cataloged in case of system failure.While mapping applications to databases using a unified terminology might seem to be a good idea from the start, but when it comes to generating a data model of interconnections based on terminology – confusion will arise. This confusion could lead to misinterpretations, which in turn could lead to incidents.Introduction:",Software Design
"This study was written on behalf of ESAB Research and Development department, in Laxå Sweden. One of ESAB’s product areas is developing various welding systems.Today if ESAB’s customers experience a problem with one of their welding systems they call ESAB’s service center. If the problem seems to have been caused by software, or if it requires log files to be analyzed, ESAB needs a way to get this system information from the customer’s welding system to ESAB’s employees.One of the goals with this project study was to perform an analysis answering how the system information should be sent, stored and what unit in the customer’s welding system that should send it. Another goal was to implement the solution that the analysis presented.The analysis shows that WeldPoint in combination with a web service is the best way to send the system information from the customer’s welding system. WeldPoint is a PC control and log software connected to the customer’s welding system.A web service provides a service interface enabling clients to interact with a web server. Clients communicate with the webservice using HTTP, this means that clients can easily communicate across firewalls and other network obstacles.The thesis work resulted in three different applications written in C#.NET. The first application is a simple form called WeldPoint Remote Support (WRS). This form extracts customer information, welding system information and log files from the customer and the customer’s welding system. All this information is called a case. The case is received by ESAB using the second application, WeldPoint Web service (WWS). WWS stores the received case in a database.The third application is called WeldPoint Remote Support Center (WRSC). This application is used by the ESAB employee’s to view the case sent from the customer’s welding system.The above implementation has been tested and supports a robust and secure way to send andview the system information from the customer’s welding system. The conclusions showed that all goals and requirements set by ESAB were met.",Software Design
"The main aim of the project is to provide a complete, ready to run, fully customizable website for listing and managing Classified Advertisements.The features of this project are:Easily create ad listingsBuilt-in search and categories simplifies finding adsBuilt-In Site AdministrationTechnologies and Design Approaches Demonstrated:Download Source Code – Sulekha Classifieds Website using ASP.net and C#.net>> List of Projects in JAVA, ASP.Net, C#.Net, VB.Net, J2EE, J2ME, PHP, SQL etc.",Software Design
"Consistent monitoring of vital health parameters is an important issue in the medical industry. With recent technologies we are able to carry out remote monitoring of physiological parameters in patients. This allows communication between a patient and medical personnel using a smart-phone, which will collect, analyze and transfer heart rate and oxygen saturation data for subsequent review by a medical professional.Before any on-line analysis is performed on the phone it is necessary to clarify the nature of the correlation between these medical parameters. In the current thesis we establish connection between a patient wearing a pulse-oxymeter and a smart-phone running Android and perform continuous data collection. All measurements were done in consultation with medical facility and involved real patients.This data is subsequently analyzed using change point detection and anomaly detection algorithms in off-line mode. Both techniques are complementary to each other and showed reliable results which could be useful for a medical review.",Software Design
"This study was made for Cybercom in Ostersund. They wanted an evaluation of HTML5 cross platform applications which studied HTML5 features as well as JavaScript libraries and frameworks. The resources put into mobile application development can be reduced by making applications that can work on all platforms instead of only natively.These types of applications are called cross platform applications and can be developed with specific tools.One way to develop cross platform applications is by using HTML5, which can either be used as a web application or packed into native applications using plug-ins. The purpose of this study was to create a mobile web app that can save maps to be used online. The work was done by evaluating frameworks for web applications.Frameworks that provide user interface elements and features similar to those in native applications, and libraries that render maps served by map servers. Development environments for web development were also tested and evaluated. The results of the research and development were documented experience, and a HTML5 application that shows a map, has GPS functionality and can be used online.",Software Design
"Nowadays people use maps everyday in many situations. Maps are available and free. What was expensive and required the user to get a paper copy in a shop is now available on any Smartphone. Not only maps but location-related information visible on the maps is an obvious feature.This work is an application of opportunistic networking for the spreading of maps and location-related data in an ad-hoc, distributed fashion. The system can also add user-created information to the map in form of points of interest. The result is a best effort service for spreading of maps and points of interest. The exchange of local maps and location-related user data is done on the basis of the user position. In particular, each user receives the portion of the map containing his/her surroundings along with other information in form of points of interest.",Software Design
"Mobile devices are becoming more common in health care and studies show that they can contribute with a lot of benefits. The purpose of this thesis is to investigate what important factors should be considered when designing an application for a tablet computer to be used at an emergency department.The project involved creating a prototype for an application that would be used as a decision support system for doctors when a stroke patient arrives to the emergency department – a case where time and accuracy are both equally important. Research was conducted by doing field studies and interviews, and the results from these helped to develop a prototype.Usability tests were conducted on the prototype and changes were made accordingly. The study showed that there are many important factors to consider; e.g. identifying the workflows, creating a non-linear system and overview support.",Software Design
"This is a small project for an advertising agency in ASP.Net and C#.The main features of this system are: Ad Details, Ad Request, Ad Creation, Ad Rejection, Staff Functionality, Staff View, etc.Main files of the system include:AdvList.aspxBudget.aspxBudgetList.aspxBudgetList.aspx.resxCreateList.aspxLogin.aspxNewUser.aspxDownload Ad Agency System Source Code in ASP.Net and C#",Software Design
"The Classifieds Site Starter Kit provides a complete, ready to run, fully customizable, Web site for listing and managing classified advertisements.Easily create ad listings",Software Design
