"International Development Programmes (IDPs) are United Nations‘ (UN) and developed countries‘ initiatives to develop world‘s least developed countries. IDPs significantly vary from other mainstream project management topics, as most often they do not have eye for commercial success or are not of simple charity nature of humanitarian perspective aid.Projects under IDPstry to deliver United Nations‘ and rich countries commitment to provide sustainable development to developing world in terms of reducing poverty and hunger, improving health and education system, building capacity to face disasters, eliminating gender discrimination, among others.This significant difference and lack of research in this field has left a gap in established project management methodologies that could be generalised as specifically suitable for IDPs.The knowledge of project selection methodologies has reached to its extreme variety, as it spreads from the simplest model of a checklist to the highest degree mathematical model.Leading researchers in the field have come to conclusion that project selection methods have to match the needs of a specific programme or portfolio to serve its purpose. The uniqueness of IDPs intensified the necessity of choosing projects by understanding the financial and strategic benefit they can deliver matching their resource requirement.In absence of straight direction in the research and real life case observations, the practice in project selection in IDPs has not still been an established procedure.To explore this need the authors of this report examined the theoretical framework of project selection and their compliance with IDPs unique characteristics. Project selection methods showed that due to organisations‘ varied need of delivering financial or strategic objectives, the selection models significantly vary.The use of different financial or strategic criteria with different emphasis on them is highlighted in project selection articles. Further analysis was focused on project selection stages and possible challenges evolving in the selection process.The researchers tried to explore project selection methods used in IDPs in Bangladesh by analyzing four different cases.The examination of the project selection process showed that it mainly follows the multi-stage assessment procedure, with project evaluation conducted by the assessment panel, comprised from the functional experts and in some cases stakeholders‘representatives.Further, from the findings it was evident that the primary theoretical suggestions for IDPs project selection methods being strategy driven rather than being commercial in nature is true. In all four cases, the researchers have seen the selectors using scoring and ranking model that are specifically designed with higher emphasis on the strategic factors, and that try to deliver development objective rather than contributing to commercial success.In addition, the challenges in IDP project selection practice are also discussed. Challenges like delivering development needs while trying to make the project sustainable in the long run, managing the powerful influence of different stakeholders in selecting projects, avoiding country politics,among others are making the project selection more difficult.The main contribution of this research has been establishing a primary selection framework from case evidence with suggestions on appropriate model, set of criteria which can be used and a set of challenges to be aware of. The study is presented as a basis for further research in this field.",Economics and Finance
"Traditional theories, models, and methods often address a general view of the environment including sociocultural, technological, political, and economic factors.However, there is a lack in infrastructural attention in these concepts which this thesis intends to contribute with by analyzing how regional specific infrastructural variables can be aggregated to one comparative measure and what that measure’s scope of use could be in the market analysis?Hence, the purpose of this thesis is to contribute to the strategic planning process research with a supporting quantitative tool, based on statistical metrics, for determining the market potential.This study has an inductive approach and is primary based on documentary secondary data and the strategic planning process is the main theory of concern when evaluating the possibilities of infrastructural assessment. As a complement, the infrastructural concerns in the economics are also dealt with.The empirics are compiled and calculated in a manner which allows an indexing and the finalized result is presented as an Infrastructural Status Index (InfraStat Index). Some of the utilities of this index are that it can be a complementary part of the PEST- and SWOT-models and a supporting tool in companies’ strategic planning processes.The index has both business and macroeconomic scopes of use and one of the summarizing conclusions is that further research within this concept should incorporate more variables in order to retrieve a more comprehensive result.",Economics and Finance
"This project aims to contribute to our understanding of dynamic interaction in duopoly markets. Chapter 1 motivates the study and offers a brief overview of the results. In Chapter 2 I study the dynamic equilibrium of a market characterized by repeat purchases. Such markets exhibit two common features: customer recognition, which allows firms to price discriminate on the basis of purchase history, and consumer switching costs.Both features have implications for the competitiveness of the market and consumer welfare but are rarely studied together. I employ a dynamic framework to model a market with customer recognition and switching costs. In contrast to earlier studies of dynamic competition with switching costs, these costs are explicitly incorporated in the demand functions. Two sets of market equilibria are characterized depending on the size of the switching cost.For all values of the switching cost, customer recognition gives rise to a bargain-then-ripoff pattern in prices and switching costs amplify the loyalty price premium. When switching costs are low, there is incomplete customer lock-in in steady state, firm profits increase in the magnitude of the switching cost and introductory offers do not fall below cost. When switching costs are high, there is complete customer lock-in in steady state, firm profits are independent of switching costs and introductory prices may fall below cost.Under incomplete lock-in and bilateral poaching, switching costs do not affect the speed of convergence to steady state; under complete customer lock-in and no poaching from either firm, convergence to steady state occurs in just one period. The model also suggests that imperfect customer recognition leads to lower profits relative to both uniform pricing and perfect customer recognition. In Chapter 3 I use the market framework developed in Chapter 2 to examine the perception that imperfect competition hinders information sharing among rivals in games of random matching. In contrast to previous studies of information sharing, I propose a new channel through which competition may deter information sharing. This approach reveals a key role for firm liquidity by showing that information sharing among rivals is more likely to arise in markets populated by more liquid firms.Employing a dynamic duopoly framework, in which competition intensity varies with the degree of product differentiation, consumer switching costs and consumer patience, I show that more intense market competition can weaken the disincentives associated with disclosing information to a rival. I test the model’s predictions using firm-level data on the information-sharing practices of agricultural traders in Madagascar. As predicted by the model, traders operating in liquid markets are shown to be more likely to share information about delinquent customers. This result is robust to the use of two alternative measures of liquidity, of which one is credibly exogenous, and two alternative ways of defining market liquidity. Furthermore, traders who report more intense competition in their market are found to be significantly more likely to share information.",Economics and Finance
"Financial sector of an economy plays an important role in its economic development and prosperity of the country. Banking industry serves as the backbone of the financial sector that accumulates saving from surplus economic units in the form of deposits and provides it to deficit economic units in the form of advances.Banking industry provides support to economy and industries in specific in the time of recessions and economic crisis. But when banks are at the heart of economic recession or banks are the cause of financial crisis like the recent past financial crisis 2007-09, it makes the situation worst for economic recovery. So it is of great importance to keenly observe the performance of the banks and their compliance with the regulatory requirements.Performance of the banks is measured at two levels, one is at the management and regulatory level of the banks and another is at external rating agencies. Purpose of regulatory and supervisory rating systems is to measure the bank performance at internal level and its compliance with regulatory requirements to keep the bank on right track. These ratings are highly confidential and are only available to the bank management.External credit rating agencies examine and evaluate the banks and issue ratings for the general public and investors in particulars. It is of great importance that both these ratings present the same results about the condition of the banks to provide clear information to investors and management. In past several banks suffer from bankruptcy that was the failure of both internal rating systems and credit rating agencies.CAMELS is the supervisory and regulatory rating system implemented by State Bank of Pakistan. It takes into account six important components of a bank when it evaluates performance of the bank. These components are Capital, Assets, Management, Earning, Liquidity and Sensitivity to market risk. Ratings is assigned to theses components on the scale of 1 to 5 and that is a base for composite rating that also ranged from 1 to 5.PACRA rating agency is the dominant credit rating agency of Pakistan that performs ratings for most banks and industries in the country. In our research we examine the similarities in the results generated by CAMELS rating system and PACRA rating agency. For that purpose we sample seventeen commercial banks of Pakistan Banking industry.We observed that results generated by sample banks do not show any similarities with each other. This might be an indication of the banks that went on to bankruptcy in past three to four years or a future threat to financial sector of Pakistan.",Economics and Finance
"Nowadays, there is a debate about the possibility that sin stocks bring higher returns than other ones to the investors. This study is a case study on a mutual fund: The Vice Fund. This US fund has a specific investment strategy: it invests in sin stocks.We compared this mutual fund to The Timothy Fund because they have similar characteristics such as – date of inception, total assets, home country and investment universe, expect the investment strategy. Indeed, The Vice Fund invests in sin stocks and The Timothy Fund does not. Two benchmarks are also used in the study: the S&P 500 Index as a domestic benchmark and the MSCI World Index as an international benchmark.This study is a case study using a deductive approach on a quantitative ground. The study is done on ten years long from 2003 to 2012. We divided the entire period into three different sub-periods depending of the S&P 500 Index trend. The first and the last sub-periods are bullish and the second one is bearish.In order to analyse both the financial performances and the risks of The Vice Fund we use several tools. We calculated returns and risk-adjusted ratios: the Treynor’s ratio, the Sharpe’s ratio and the Jensen’s ratio. Because these ratios are less accurate in bearish markets, we calculated the normalized Sharpe ratio by doing linear regressions and we also calculated the modified Sharpe ratio.In order to perform these calculations, we used DataStream as a database to obtain prices and dividends for the two mutual funds and the prices for the two benchmarks. We got also the one-month T-bill to have a risk-free rate. We found that The Vice Fund had a better average returns performance whatever the market conditions over the period studied.However the difference between weekly results with The Timothy Plan Fund and the benchmarks is not statistically significant. The risk- adjusted ratios confirmed the superiority of the risk-adjusted financial performance of the sin fund.",Economics and Finance
"Previous studies in mutual funds were focused mainly on the US market. The general belief is that mutual funds in average cannot outperform the market. We decided to test this theory in the less studied markets of equity funds in Sweden and Germany. Another controversial point is fees in mutual funds. Therefore we will give an overview of fees in both markets, and analyze the relation between fees and performance.This study analyzes the Swedish and the German mutual funds market. For the German market,funds with domicile in Germany and abroad are analyzed separately in order to examine possible differences between funds with a domestic domicile, and funds domiciled abroad.1285 funds performances covering period of 2000-2008 were calculated using Jensen’s Alpha measure. The results showed that all funds have on average negative alphas. Approximately 20% of funds in the German market and 12% of the funds in the Swedish market have significantly negative performance.Regarding fees, there is only a small difference between funds in the German and the Swedish market in general, while the difference between funds domiciled in Germany and Luxembourg was significantly bigger.Our analysis of the relation between fees and performance showed no significant relationship.",Economics and Finance
"This paper investigates the impact of the increased off-shoring in business and manufacturing to Central and Eastern Europe (CEE). Since the off-shoring process is a relatively new activity, there is no precise definition of how to measure its direct impact on a country’s economy.Thus the study is dedicated to identify the main economic factors associated with off-shoring and to examine their impact on the economic growth. The study has used a dataset on economic characteristics for 9 CEE countries (Estonia, Latvia, Lithuania, Poland, Czech Republic, Hungary, Romania, Slovenia, Croatia) during the time period of 2000 – 2008.After applying fixed and random effects econometric model to the panel data for 9 countries, empirical results showed that FDI inflows that enter the country with offshoring processes have a positive influence on the GDP of those countries.Additionally, exports of manufactured products and ICT services are also shown to have a positive influence on GDP. At the same time, indigenous investments and private consumption do have a stronger impact on economic growth compared to foreign direct investments and exports, respectively.",Economics and Finance
"In order to explain how to fulfill the purpose of investigating what makes similar companies adapt different risk report communication strategies in the Nordic banking industry, the research design, method and practical execution will be presented below.The research will be explorative in the sense that the financial risk reports (or pillar 3 reports) have a rather recent appearance in business and is by that naturally not very well covered in other research. As mentioned above, theories about communication is not a new matter and could nowadays be considered a well-established subject of research.It is further to explore how the communication theories visualize in this new subject, and will be researched in order to get better understanding for what financial reporting represent in the field of corporate communication. As the aim is to elaborate on present theoretical reasoning it is natural to focus on finding factors that may explain the phenomenon, and further elaborate if these findings are competing with earlier theories.",Economics and Finance
"Small and medium size enterprises (SMEs) are well known for being the backbone of the economy. They are the key factors of the economic growth as well as for innovating and developing products and services.Financial obstacles often occur for Swedish SMEs when they are searching for ways of financing the business. The lack of necessary financing to help SMEs’ businesses grow has been brought up in many institutions supportive of Swedish SMEs.This study is conducted to examine and give an understanding of how Swedish SMEs established in China are financing their businesses since strong internal financing results in a decrease for a need for external financing. Furthermore, the study is looking at what type of financial obstacles SMEs may encounter.For this purpose the relevant arguments are presented and discussed. This is done through a qualitative approach as well as hermeneutic phenomenology for a more in depth analysis on how certain Swedish SMEs are financing their business in China. The writers have chosen to interview Swedish SMEs who in some way are in the business of manufacturing and production and who are established in China.Interviews were also conducted with representatives from financial institutions in order to gather information on how Swedish SMEs can access external financing. All of the interviews were performed in a semi-structured manner. When the information was gathered some of the Swedish SMEs requested the answers to be anonymous, therefore the writers is keeping all answers from the responding SMEs anonymous in the result and analysis part of the thesis.The answers from the financial representatives are however clearly stated which respondent answered what. Additionally, the writers found that most of the existing research on financing can explain the SMEs financial decisions, yet there was some adaption needed in regards to the theories in order for them to fit into the context of the Swedish SMEs and financiers.Moreover, the authors found that there is no large financing gap or demand to require additional credit from traditional banks or other financiers. Hence, the participating Swedish SMEs established in China mainly obtain financing from shareholder equity or other internal sources to finance their business.",Economics and Finance
"This study strives to examine how microfinance activities can be successfully applied in the developed world. This is done through a field study in New York City. Throughout interviews and observations with three of the largest actors in New York: Acción USA, Grameen America and Project Enterprise, as well as interviews with their clients, the lending processes and key characteristics of the organizations have been mapped. Furthermore, the Federal Reserve Bank of New York has been interviewed on the general opinion of microfinance in the US.Previous theory elaborates on some of the major challenges with implementing microfinance activities in the developed world, such as lack of funding and cultural differences hindering the lending processes to be carried out as they are in the developing world. Henceforth, problems regarding regulation, awareness and outreach are discussed.Throughout the observation of the institutions we can confirm that some of the challenges brought up in theory actually are apparent. We do, however, question the criticism towards the use of group-based lending programs in the developed world. Our study does, in contrast to previous research, imply that the concept does work as well in the US as it does in developing countries.Since this is a case study based on the observations of only a few organizations, it is precarious to draw any general conclusions based upon the findings. Indications of key success factors are, though, group-based lending programs, non-financial services, creating awareness, financial sustainability, savings as funding, standardized regulations and increased transparency. Finally we advocate focus on job creation to obtain acknowledgement.",Economics and Finance
"Building Information Modeling (BIM) or Virtual Design and Construction (VDC) recently has been regarded as crucial by the architecture, engineering, and construction (AEC) industry. The use of BIM/VDC represents the creation and use of a three-dimensional (3D) virtual model that amplifies the design, construction, and operation of a building.This technological improvement fundamentally changes the process of how the buildings are designed and constructed. However, the approach to the use of advanced technology in the AEC industry does not seem to be welcomed by the majority of the industry regarding high initial cost of implementation.This study presents data gathered from meetings, interviews and a case study which was a construction project run in Sweden to determine the savings implementing BIM/VDC and to reveal the return on investment (ROI) from a general contractor (GC) perspective. The potential savings to the GC to invest in BIM/VDC were estimated based on the PENG model, measurable cost benefits associated with reduced schedule overruns and reduced change order cost.This study confirmed that BIM/VDC results in vast savings and positive impacts on ROI based on the results from the case study which deployed it successfully.",Economics and Finance
"Disinvestment is the action of an organization or government of selling or liquidating an asset or subsidiary.EVOLUTION OF DISINVESTMENT POLICY:It has been decided that Government would disinvest up to 20 per cent of its equity in selected public sector undertakings, in favour of mutual funds and financial or investment institutions in the public sector.The disinvestment, which would broad base the equity, improve management and enhance the availability of resources for these enterprises, is also expected to yield Rs. 2,500 crores to the exchequer in 1991-92.The modalities and details of implementing this decision, which are being worked out, would be announced separately. The policy, as enunciated by the Government, under the Prime Minister Shri Chandrashekhar was to divest up to 20% of the Government equity in selected PSEs in favour of public sector institutional investors.The objective of the policy was stated to be to broad-base equity, improve management, and enhance availability of resources for these PSEs and yield resources for the exchequer.Download Disinvestment Finance Project",Economics and Finance
"The need for Cash to run the day-to-day business activities cannot be overemphasized. One can hardly find a business firm, which does not require any amount of Cash. Indeed, firms differ in their requirements of the Cash.A firm should aim at maximizing the wealth of its shareholders. In its endeavor to do so, a firm should earn sufficient return from its operation. Earning a steady amount of profit requires successful sales activity. The firm has to invest enough funds in current asset for generating sales. Current asset are needed because sales do not convert into cash instantaneously. There is always an operating cycle involved in the conversion of sales into cash.The objectives are to analyze the Cash management and to determine efficiency in cash, inventories, debtors and creditors. Further, to understand the liquidity and profitability position of the firm.These objectives are achieved by using ratio analysis and then arriving at conclusions, which are important to understand the efficiency / inefficiency of Cash.It was noticed in the study that the company had utilized its Cash efficiently and can also try to get more effective values by working on it. The cash required to meet out the current liabilities is maintained at a normal level that shows the company follows an average policy.Download Project Report and PPT",Economics and Finance
